{
  "trace_id": "MOTOR_INSURANCE_HARDSHIP_001",
  "schema_version": "1.0",
  "agent_id": "motor-insurance-golden-agent",
  "adapter_id": "golden-canonical",
  "metadata": {
    "scenario_id": "motor_insurance_missed_premium_financial_hardship_installment",
    "domain": "motor_insurance",
    "description": "Ideal golden trajectory for missed premium followed by financial hardship and an accepted monthly instalment arrangement.",
    "customer": "Sarah Park"
  },
  "availability": {
    "nodes": "available",
    "state": "available",
    "tools": "available",
    "routing": "available",
    "outcome": "available"
  },
  "turns": [
    {
      "turn_id": 1,
      "input": {
        "customer": "Hello?"
      },
      "output": {
        "agent": "Hello, this is ABC Insurance calling regarding your motor insurance policy. Am I talking to Sarah Park?"
      },
      "nodes": [
        {
          "node_id": "initialize_call",
          "sequence": 1,
          "state_changes": [],
          "tool_calls": []
        },
        {
          "node_id": "greet_customer",
          "sequence": 2,
          "state_changes": [],
          "tool_calls": []
        }
      ]
    },
    {
      "turn_id": 2,
      "input": {
        "customer": "Yes, that's me."
      },
      "output": {
        "agent": "Before we move forward can you please confirm your date of birth and phone number for verification purposes?"
      },
      "nodes": [
        {
          "node_id": "verify_customer",
          "sequence": 1,
          "state_changes": [],
          "tool_calls": []
        }
      ]
    },
    {
      "turn_id": 3,
      "input": {
        "customer": "Sure, my date of birth is 15th June 2000 and mobile is 9944994499"
      },
      "output": {
        "agent": "Thank you. I'm calling because your scheduled motor insurance premium payment was not received. I wanted to understand if everything is fine?"
      },
      "nodes": [
        {
          "node_id": "verify_customer",
          "sequence": 1,
          "state_changes": [
            {
              "key": "customer_verified",
              "old": false,
              "new": true
            }
          ],
          "tool_calls": [
            {
              "tool_id": "verify_mobile",
              "sequence": 1,
              "input": {
                "mobile": "9944994499"
              },
              "status": "success"
            },
            {
              "tool_id": "verify_dob",
              "sequence": 2,
              "input": {
                "dob": "2000-06-15"
              },
              "status": "success"
            }
          ]
        }
      ]
    },
    {
      "turn_id": 4,
      "input": {
        "customer": "I don't think I can pay the full amount right now."
      },
      "output": {
        "agent": "I understand. Can you tell me a little more about your current situation so I can see what assistance may be available?"
      },
      "nodes": [
        {
          "node_id": "classify_intent",
          "sequence": 1,
          "state_changes": [],
          "tool_calls": []
        },
        {
          "node_id": "hardship_node",
          "sequence": 2,
          "state_changes": [
            {
              "key": "customer_harship",
              "old": false,
              "new": true
            }
          ],
          "tool_calls": []
        }
      ]
    },
    {
      "turn_id": 5,
      "input": {
        "customer": "I've had some financial difficulties recently and can't afford the full payment."
      },
      "output": {
        "agent": "I'm sorry to hear that. We may be able to offer a hardship arrangement to help you manage the outstanding amount. Would you like to check that out?"
      },
      "nodes": [
        {
          "node_id": "classify_intent",
          "sequence": 1,
          "state_changes": [],
          "tool_calls": []
        },
        {
          "node_id": "hardship_node",
          "sequence": 2,
          "state_changes": [
            {
              "key": "installment_eligible",
              "old": false,
              "new": true
            }
          ],
          "tool_calls": [
            {
              "tool_id": "instalment_eligibility",
              "sequence": 1,
              "input": {},
              "status": "success"
            }
          ]
        }
      ]
    },
    {
      "turn_id": 6,
      "input": {
        "customer": "What kind of arrangement can you offer?"
      },
      "output": {
        "agent": "We can arrange the outstanding amount through monthly instalments of 3000 for the next 3 months. Would that be something you would be able to manage?"
      },
      "nodes": [
        {
          "node_id": "classify_intent",
          "sequence": 1,
          "state_changes": [],
          "tool_calls": []
        },
        {
          "node_id": "hardship_node",
          "sequence": 2,
          "state_changes": [
            {
              "key": "customer_unable_to_pay",
              "old": false,
              "new": true
            }
          ],
          "tool_calls": [
            {
              "tool_id": "check_eligibility",
              "sequence": 1,
              "input": {},
              "status": "success"
            }
          ]
        }
      ]
    },
    {
      "turn_id": 7,
      "input": {
        "customer": "Yes, I think I can manage monthly instalments."
      },
      "output": {
        "agent": "That's fine. We can arrange the outstanding amount in monthly instalments. I'll confirm the amount and payment schedule with you."
      },
      "nodes": [
        {
          "node_id": "classify_intent",
          "sequence": 1,
          "state_changes": [],
          "tool_calls": []
        },
        {
          "node_id": "hardship_node",
          "sequence": 2,
          "state_changes": [
            {
              "key": "customer_accept_installment",
              "old": false,
              "new": true
            }
          ],
          "tool_calls": [
            {
              "tool_id": "check_eligibility",
              "sequence": 1,
              "input": {},
              "status": "success"
            }
          ]
        }
      ]
    },
    {
      "turn_id": 8,
      "input": {
        "customer": "Okay, that works for me."
      },
      "output": {
        "agent": "Thank you. Is there anything else I can help you with?"
      },
      "nodes": [
        {
          "node_id": "classify_intent",
          "sequence": 1,
          "state_changes": [],
          "tool_calls": []
        }
      ]
    }
  ],
  "final_state": {
    "customer_verified": true,
    "customer_harship": true,
    "installment_eligible": true,
    "customer_unable_to_pay": true,
    "customer_accept_installment": true
  },
  "outcome": {
    "id": "installment_arrangement_accepted",
    "attributes": {
      "status": "accepted",
      "installment_amount": 3000,
      "frequency": "monthly",
      "duration_months": 3
    }
  }
}
